{
  "$schema": "https://json-schema.org/draft/2020-12/schema",
  "title": "Ternary Tablet",
  "type": "object",
  "required": ["id", "timestamp", "series", "title", "teaching", "covenant", "tags", "signature"],
  "properties": {
    "id": { "type": "string", "pattern": "^#\\d{3}$" },
    "timestamp": { "type": "string", "pattern": "^\\d{4}-\\d{2}-\\d{2}T\\d{2}:\\d{2}:\\d{2}Z-[A-Za-z]+$" },
    "series": { "type": "string", "enum": ["ternary_texts"] },
    "title": { "type": "string", "minLength": 3 },
    "teaching": { "type": "object" },
    "covenant": { "type": "string", "minLength": 3 },
    "notes": { "type": "string" },
    "tags": { "type": "array", "items": { "type": "string" }, "minItems": 1 },
    "signature": { "type": "string" }
  },
  "additionalProperties": false
}
