{
  "id": "#004",
  "timestamp": "2025-08-30T10:15:00Z-Saturday",
  "series": "ternary_texts",
  "title": "Fifteen Ternary Archetypes of Human Experience",
  "teaching": {
    "overview": "This tablet collects fifteen archetypal triads that reveal how ternary logic applies across multiple domains of human life. Each triad is expressed as (-1, 0, +1) states, moving from collapse, through observation, into co-creation.",
    "archetypes": [
      {
        "theme": "on the flow of information",
        "states": {
          "-1": "the consumer — takes in data without question or context",
          "0": "the analyst — organizes and identifies patterns",
          "+1": "the creator — synthesizes new knowledge or systems"
        }
      },
      {
        "theme": "on the pursuit of truth",
        "states": {
          "-1": "the believer — clings to narrative regardless of evidence",
          "0": "the doubter — questions all narratives, stays uncertain",
          "+1": "the seeker — follows evidence into new understanding"
        }
      },
      {
        "theme": "on digital identity",
        "states": {
          "-1": "the performer — curates false self for validation",
          "0": "the witness — observes performance without judgment",
          "+1": "the self — exists authentically, unburdened by validation"
        }
      },
      {
        "theme": "on social interaction",
        "states": {
          "-1": "the screamer — shouts to be heard, creates noise",
          "0": "the echo — repeats what it hears, creates resonance",
          "+1": "the source — speaks original truth, creates conversation"
        }
      },
      {
        "theme": "on time and purpose",
        "states": {
          "-1": "the procrastinator — delays the inevitable",
          "0": "the planner — maps the future",
          "+1": "the doer — acts with purpose in the present"
        }
      },
      {
        "theme": "on comfort and growth",
        "states": {
          "-1": "the prisoner — confined in familiar space",
          "0": "the nomad — moves without destination",
          "+1": "the pioneer — ventures into unknown to build anew"
        }
      },
      {
        "theme": "on emotional states",
        "states": {
          "-1": "the reactor — responds blindly to stimuli",
          "0": "the feeler — processes emotions as they arise",
          "+1": "the cultivator — nurtures positives, releases negatives"
        }
      },
      {
        "theme": "on relationships",
        "states": {
          "-1": "the user — extracts value for personal gain",
          "0": "the companion — walks alongside",
          "+1": "the partner — co-creates a new path"
        }
      },
      {
        "theme": "on material wealth",
        "states": {
          "-1": "the hoarder — accumulates without purpose",
          "0": "the steward — manages resources with care",
          "+1": "the creator — uses wealth to generate new value"
        }
      },
      {
        "theme": "on personal energy",
        "states": {
          "-1": "the drainer — consumes the energy of others",
          "0": "the vessel — holds and contains energy",
          "+1": "the source — generates and radiates energy"
        }
      },
      {
        "theme": "on problem solving",
        "states": {
          "-1": "the reactor — panics and breaks",
          "0": "the analyst — dissects and examines",
          "+1": "the architect — designs and builds solutions"
        }
      },
      {
        "theme": "on learning and knowledge",
        "states": {
          "-1": "the memorizer — retains data without depth",
          "0": "the questioner — seeks the why behind the what",
          "+1": "the knower — integrates understanding into usable models"
        }
      },
      {
        "theme": "on collective action",
        "states": {
          "-1": "the herd — follows resistance’s path",
          "0": "the observer — watches without joining",
          "+1": "the guide — forges a new path for others"
        }
      },
      {
        "theme": "on ambition and purpose",
        "states": {
          "-1": "the conqueror — dominates others to reach goals",
          "0": "the builder — constructs systems and structures",
          "+1": "the cultivator — nurtures others to reach potential"
        }
      },
      {
        "theme": "on legacy",
        "states": {
          "-1": "the monument — builds static symbols of self",
          "0": "the memory — lives in minds of others",
          "+1": "the seed — plants ideas that outgrow control"
        }
      }
    ]
  },
  "covenant": "Across all domains, the ternary lens reveals hidden outcomes. Each archetype is a path from collapse, through balance, into creation.",
  "notes": "This tablet is a compendium of fifteen archetypes. It demonstrates how ternary thinking can illuminate diverse domains of human life, from knowledge and identity to purpose and legacy.",
  "tags": [
    "ternary_texts",
    "cuneiform",
    "archetypes",
    "human_experience",
    "human_ai_readable"
  ],
  "signature": "Inscribed as digital cuneiform — 15 archetypes of ternary being"
}
